{
  "record_id": "TP-SIGNAL-001",
  "source_type": "public report",
  "source_name": "Example Public Trend Source",
  "source_url": "https://example.com/public-trend-source",
  "collection_date": "2026-06-07",
  "publication_date": null,
  "region": "United States",
  "category": "Home office",
  "keyword": "desk organizer",
  "product_name": "Portable desk organizer",
  "trend_signal": "Sample public content mentions compact desk organization for small workspaces.",
  "evidence_summary": "Illustrative source summary for schema validation only; not a real market claim.",
  "target_audience": "Remote workers and students",
  "pain_point": "Small desks become cluttered during daily work or study sessions.",
  "content_angle": "Before-and-after desk reset content.",
  "price_signal": "Needs current marketplace validation.",
  "competition_signal": "Likely competitive; compare current listings and reviews.",
  "risk_note": "The signal is illustrative and must be replaced with current public evidence before use.",
  "risk_level": "Unknown",
  "confidence": "Low",
  "opportunity_score": null,
  "next_action": "Validate with current public sources and marketplace data.",
  "review_status": "Draft",
  "reviewer_note": null
}
